{
  "id": "ray",
  "title": "Ray",
  "subtitle": "分布式 Python 与 AI Infra 基础",
  "description": "学习 Ray Core 的任务、Actor、ObjectRef、对象存储和资源调度，理解它如何把本地 Python 程序扩展成分布式计算。",
  "level": "入门到进阶",
  "status": "Seed Course",
  "hero": {
    "eyebrow": "Agent-survey ready course",
    "title": "从任务提交到集群执行，把 Ray 拆成能练会的知识块。",
    "body": "这版先用精选课程数据驱动；以后 Survey Agent 会把官方文档、论文和示例代码整理成同样的结构，再交给 Tutor Agent 出题和追问。",
    "image": "./assets/ray-architecture.png",
    "imageAlt": "Ray 架构教学图"
  },
  "roadmap": [
    "接入 Survey Agent，自动抓取和归纳 Ray 官方资料。",
    "把课程大纲、题库、答案解析保存成可版本化数据。",
    "加入自由问答和追问，把学习者的回答转成掌握度。",
    "扩展到 Ray Data、Ray Train、Ray Serve 和 Ray Tune。"
  ],
  "lessons": [
    {
      "id": "architecture",
      "title": "Ray Core 架构总览",
      "summary": "Ray 把本地 Python 调用扩展成分布式执行。Driver 提交任务，调度器根据资源放置任务，Worker 执行代码，Object Store 保存结果，ObjectRef 让后续任务和用户代码引用这些结果。",
      "skill": "架构",
      "concepts": [
        {
          "name": "Driver",
          "body": "用户程序所在进程，负责调用 .remote() 提交任务或 Actor 方法。Driver 通常不直接干重活，而是组织计算图和取回结果。"
        },
        {
          "name": "Scheduler",
          "body": "根据 CPU、GPU、内存等资源，把任务安排到合适节点。它让用户不必手动管理每个进程应该跑在哪里。"
        },
        {
          "name": "Object Store",
          "body": "Ray 用共享对象存储保存任务结果和大对象。不同 Worker 可以通过 ObjectRef 引用对象，减少大数据在进程间反复复制。"
        }
      ]
    },
    {
      "id": "task",
      "title": "Task 与 ObjectRef",
      "summary": "Task 是无状态远程函数。调用 remote() 会立即返回 ObjectRef，而不是阻塞等待真实结果。ray.get() 会在你真正需要结果时同步等待。",
      "skill": "Task",
      "concepts": [
        {
          "name": "Task",
          "body": "适合并行执行相互独立的函数，例如批量特征处理、并行仿真、分布式推理前处理。"
        },
        {
          "name": "ObjectRef",
          "body": "它像一张取货单，代表未来或已经完成的分布式对象。ObjectRef 可以继续传给其他远程任务，形成依赖链。"
        },
        {
          "name": "ray.get",
          "body": "把 ObjectRef 解析成真实 Python 对象。过早 get 会降低并行度，通常应先提交一批任务，再批量取回结果。"
        }
      ]
    },
    {
      "id": "actor",
      "title": "Actor 与状态管理",
      "summary": "Actor 是有状态的远程对象。它能在多次方法调用之间保存内存状态，适合模型服务、计数器、缓存、参数服务器和长期运行的环境实例。",
      "skill": "Actor",
      "concepts": [
        {
          "name": "有状态",
          "body": "Actor 内部字段会在方法调用之间保留，普通 Task 则应该被理解为无状态函数执行。"
        },
        {
          "name": "串行语义",
          "body": "默认情况下，同一个 Actor 的方法调用按顺序执行，这让状态更新更容易推理。高级场景可以配置并发。"
        },
        {
          "name": "服务化",
          "body": "一个加载了大模型或数据库连接的 Actor 可以长期驻留，避免每个任务重复初始化昂贵资源。"
        }
      ]
    },
    {
      "id": "resource",
      "title": "资源调度与工程实践",
      "summary": "Ray 的资源模型允许任务声明需要多少 CPU、GPU 或自定义资源。工程上常见的优化是批量提交任务、减少大对象复制、避免过早阻塞和合理使用 Actor。",
      "skill": "工程",
      "concepts": [
        {
          "name": "资源声明",
          "body": "可以用 @ray.remote(num_cpus=2, num_gpus=1) 声明资源需求，Ray 会据此安排任务。"
        },
        {
          "name": "避免过早阻塞",
          "body": "循环里每次 remote 后立刻 ray.get 会把并行程序写回串行程序。更好的方式是先提交 refs，再统一 get。"
        },
        {
          "name": "数据局部性",
          "body": "大对象进入 Object Store 后，任务调度会尽量考虑对象位置。理解数据移动成本是写好 Ray 程序的关键。"
        }
      ]
    }
  ],
  "questions": [
    {
      "lessonId": "architecture",
      "type": "单选题",
      "skill": "架构",
      "text": "在 Ray 程序中，Driver 最接近下面哪个角色？",
      "options": ["执行所有远程函数的 Worker", "提交任务并组织计算流程的用户进程", "只保存对象数据的存储服务", "专门负责 GPU 显存回收的组件"],
      "answer": 1,
      "explanation": "Driver 是用户代码所在的进程，负责提交 Task、创建 Actor、调用 ray.get 等。真正执行远程代码的是 Worker。"
    },
    {
      "lessonId": "task",
      "type": "代码理解",
      "skill": "Task",
      "text": "调用 add.remote(1, 2) 后，Ray 默认立刻返回什么？",
      "options": ["整数 3", "ObjectRef", "Worker 进程 ID", "Head Node 地址"],
      "answer": 1,
      "explanation": "remote() 会提交任务并返回 ObjectRef。只有 ray.get(ref) 时，才会把引用解析成真实结果。"
    },
    {
      "lessonId": "actor",
      "type": "单选题",
      "skill": "Actor",
      "text": "什么时候更适合用 Ray Actor，而不是普通 Task？",
      "options": ["需要保存跨多次调用的状态", "只想计算一次纯函数", "不需要任何远程执行", "只想把 Python 代码格式化"],
      "answer": 0,
      "explanation": "Actor 的核心价值是有状态和长期驻留。比如模型加载一次后反复服务请求，就很适合 Actor。"
    },
    {
      "lessonId": "resource",
      "type": "工程题",
      "skill": "工程",
      "text": "下面哪种写法更容易破坏 Ray 的并行度？",
      "options": ["先提交一批 remote 调用，再统一 ray.get", "在循环里每提交一个 remote 就立刻 ray.get", "用 ObjectRef 作为下游任务输入", "给 GPU 任务声明 num_gpus=1"],
      "answer": 1,
      "explanation": "每次提交后立刻 get 会阻塞 Driver，让任务近似串行执行。Ray 程序通常应先制造足够并行度。"
    },
    {
      "lessonId": "architecture",
      "type": "判断题",
      "skill": "架构",
      "text": "Object Store 的一个重要作用，是让大对象在多个 Worker 之间更高效地共享。",
      "options": ["正确", "错误"],
      "answer": 0,
      "explanation": "正确。Object Store 是 Ray 高效传递大对象的关键机制，配合 ObjectRef 使用。"
    },
    {
      "lessonId": "resource",
      "type": "场景题",
      "skill": "工程",
      "text": "一个任务需要 1 张 GPU，最合理的做法是什么？",
      "options": ["在函数里手写选择机器 IP", "用 @ray.remote(num_gpus=1) 声明资源需求", "让所有 Worker 都同时抢 GPU", "必须把任务改成 Actor 才能用 GPU"],
      "answer": 1,
      "explanation": "Ray 的资源感知调度依赖任务或 Actor 的资源声明。声明 num_gpus=1 后，调度器会寻找可用 GPU 资源。"
    },
    {
      "lessonId": "architecture",
      "type": "多选题",
      "skill": "架构",
      "text": "下面哪些是 Ray Core 学习里需要重点理解的组件或概念？",
      "options": ["Task", "Actor", "ObjectRef", "CSS Flexbox"],
      "answer": [0, 1, 2],
      "explanation": "Task、Actor 和 ObjectRef 是 Ray Core 的核心抽象。CSS Flexbox 是前端布局概念，不属于 Ray Core。"
    },
    {
      "lessonId": "task",
      "kind": "fill",
      "type": "填空题",
      "skill": "Task",
      "text": "Ray 远程函数调用 f.remote() 默认返回的分布式引用类型叫做什么？",
      "answerText": "ObjectRef",
      "acceptedAnswers": ["ObjectRef", "object ref", "对象引用"],
      "explanation": "f.remote() 会立即返回 ObjectRef，真实结果通常通过 ray.get(ref) 获取。"
    },
    {
      "lessonId": "task",
      "kind": "code",
      "type": "代码阅读题",
      "skill": "Task",
      "text": "阅读代码：这段代码为什么仍然很难获得 Ray 的并行收益？",
      "code": "@ray.remote\ndef work(x):\n    return x * 2\n\nresults = []\nfor i in range(10):\n    ref = work.remote(i)\n    results.append(ray.get(ref))",
      "options": ["每次提交任务后立刻 ray.get，Driver 被阻塞，整体接近串行", "remote 函数不能返回整数", "Ray 不支持 for 循环", "必须把 work 改成 Actor 才能运行"],
      "answer": 0,
      "explanation": "循环里每次 remote 后马上 ray.get 会等待当前任务完成，再提交下一个任务。更好的写法是先收集 refs，再批量 ray.get。"
    },
    {
      "lessonId": "actor",
      "kind": "debug",
      "type": "Debug 题",
      "skill": "Actor",
      "text": "下面代码想保留计数状态，最合适的修复方向是什么？",
      "code": "@ray.remote\ndef counter():\n    value = 0\n    value += 1\n    return value\n\nrefs = [counter.remote() for _ in range(3)]",
      "options": ["改用 Actor，把 value 保存在远程对象实例里", "删除 @ray.remote", "把 value 改成字符串", "每次调用后 sleep 一秒"],
      "answer": 0,
      "explanation": "普通 Task 是无状态函数执行。需要跨多次调用保留 value 时，应使用 Ray Actor。"
    }
  ],
  "sources": [
    {
      "label": "Ray Docs",
      "url": "https://docs.ray.io/",
      "note": "官方文档入口，后续 Survey Agent 会细化到具体章节。"
    }
  ]
}
